{
    "schemaVersion": 1,
    "productId": "fixture-app",
    "channel": "stable",
    "version": "1.2.3",
    "releasedAt": "2026-08-11T15:40:42Z",
    "summary": "测试摘要文本",
    "assets":[
        {
            "id": "windows-x64-portable",
            "platform": "windows",
            "architecture": "x64",
            "packageType": "portable",
            "filename": "fixture-app-1.2.3-windows-x64.zip",
            "url": "https://example.com/downloads/fixture-app/fixture-app-1.2.3-windows-x64.zip",
            "size": 1024,
            "sha256": "0123456789abcdef0123456789abcdef0123456789abcdef0123456789abcdef"
        }
    ]
}